Pilot ID,Concept Title,Primary Audience,Venue Type,Core Experience,Rachael's Role,Possible Partners,Revenue/Support Model,Minimum Evidence Needed,Complexity,Best Timing,Success Indicator,Notes
P1,Uganda Cultural Welcome Night,"Diaspora visitors; football fans; hotel guests; sponsors",Hotel / cultural venue,"Curated Ugandan music, dance, food, fashion, craft and storytelling evening","Creative director; movement/choreography advisor; curator",Hotel; cultural performers; chef/caterer; tourism body; sponsor,"Ticketed; hotel-hosted; sponsor-supported",Profile; concept note; sample run-of-show; performer list,Medium,After stakeholder meetings,"Venue agrees to host or discuss pilot",Strong flagship concept.
P2,Football Meets Culture Showcase,"Fans; families; media; youth; tourists",Fan zone / theatre / public venue,"Short performances, football-themed movement, poetry, DJ, fashion and visual art","Artistic director; curator; choreographer",UNCC/National Theatre; event company; sponsor; youth groups,"Sponsor-supported; ticketed; institutional",Profile; concept note; technical requirements; performer map,High,After institutional partner identified,"Institution requests detailed proposal",Requires production support.
P3,Cafe Arts AFCON Pop-Up,"Tourists; diaspora; young professionals; creatives",Cafe / gallery / restaurant,"Small cultural evening with acoustic music, dance excerpt, art, Ugandan food and football conversation","Curator; host; creative consultant",Cafe owner; artist; photographer; tour operator,"Ticketed; revenue share; sponsor small grant",Venue shortlist; mini budget; one-page run-of-show,Low,Immediately possible,"One pilot date secured",Best first evidence-building pilot.
P4,Diaspora Creative Reception,"Ugandan diaspora; visiting creatives; sponsors; officials",Hotel lounge / gallery / embassy-linked venue,"Networking reception linking diaspora, tourism, arts and AFCON visitor economy","Curator; speaker; creative host",Diaspora networks; hotel; tourism actors; sponsors,"Invite-only; sponsor-supported",Profile; diaspora angle; invite list draft,Medium,After diaspora contacts mapped,"10+ serious invitees or partner interest",Strong UK-Uganda bridge.
P5,Youth Performance Mentorship Lab,"Young dancers; theatre groups; schools; cultural troupes",Studio / theatre / cultural centre,"Workshop on movement direction, stage discipline, performance quality and AFCON opportunity readiness","Lead mentor; movement director",UNCC; dance groups; schools; youth programmes,"Institution-funded; donor-supported; paid workshop",Workshop outline; Rachael bio; local partner,Medium,After local performance groups mapped,"Workshop partner agrees to host",Good legacy angle.
P6,Visitor Cultural Route Prototype,"Tourists; visiting fans; diaspora",Kampala/Entebbe city route,"Half-day route linking cafe, gallery, craft, food, performance and heritage stops","Creative tourism advisor; experience designer",Tour operator; cafe; gallery; museum; guide,"Paid tour; tour-operator partnership",Route draft; partner stops; pricing research,Medium,After research log has 5+ venues,"Tour operator reviews product",Directly supports future cafe arts space.
P7,Hotel Cultural Micro-Residency,"Hotel guests; VIPs; sponsors",Hotel lobby / lounge / garden,"Rotating short performances, art display and cultural storytelling during AFCON period","Creative director; performer curator",Hotel; artists; performers; sponsor,"Hotel contract; sponsor support",Profile; performer roster; sample schedule,Medium,After hotel interest,"Hotel asks for budget and schedule",Good private-sector route.
P8,AFCON Culture Documentation Series,"Media audience; sponsors; tourism stakeholders",Digital / media / social platforms,"Short videos and photo essays on Uganda culture, football and creative economy","Creative narrator; curator; interviewer",Media house; videographer; tourism body; sponsor,"Sponsored content; media partnership",Story list; filming plan; profile,Low-Medium,Can begin early,"First 3 stories produced",Builds credibility before official roles.
